{
  "version": "1.0",
  "exportedAt": "2026-10-22T06:29:45.479Z",
  "case": {
    "name": "Control-network hardening agent (security)",
    "description": "Illustrative example. A fictional AI agent that tests a digital twin of a regional water utility's control network and proposes hardening changes."
  },
  "tree": {
    "id": "1d9e4d55-c2ca-46fc-9754-9099e6381018",
    "type": "GOAL",
    "name": "G1",
    "description": "The hardening agent is secure against the threats in its threat model, in its stated deployment.",
    "inSandbox": false,
    "children": [
      {
        "id": "5c2e3640-c2f2-4b1b-8200-b7d8a72aeeb1",
        "type": "STRATEGY",
        "name": "S1",
        "description": "Argument over preventive defences: the integrity of the models the agent runs and of the data it was fine-tuned on.",
        "inSandbox": false,
        "children": [
          {
            "id": "1af416bc-a557-4766-990d-3e0d569cb214",
            "type": "PROPERTY_CLAIM",
            "name": "P1",
            "description": "The agent's runtime loads a model only if its signature verifies against the utility's release-signing key.",
            "inSandbox": false,
            "children": [
              {
                "id": "3d8c0cb0-d7f4-4e64-84c0-a21d24a725f3",
                "type": "EVIDENCE",
                "name": "E1",
                "description": "Release test report RT-2.3, section 3: the runtime refused each of 20 unsigned or wrongly signed model files and loaded the signed release. Covers release 2.3 on the deployed runtime build; run by the release team; assumes the release-signing key has not been compromised.",
                "inSandbox": false,
                "children": []
              }
            ],
            "level": 1
          },
          {
            "id": "cd6377ac-3d0a-4f97-8751-747b5b8be502",
            "type": "PROPERTY_CLAIM",
            "name": "P2",
            "description": "Each third-party model file is scanned for embedded executable code before the agent loads it, and each release of the agent has a bill of materials listing its base model, datasets, libraries and file hashes.",
            "inSandbox": false,
            "children": [
              {
                "id": "be92dcb7-4540-4383-92da-e733f61ba20e",
                "type": "EVIDENCE",
                "name": "E2",
                "description": "Model-file scan report MS-2.3, table 1: each third-party file in release 2.3 scanned for embedded code before loading, with its findings. Covers release 2.3; scanner run in the release pipeline; assumes the scanner's list of unsafe functions is current.",
                "inSandbox": false,
                "children": []
              },
              {
                "id": "85f0121d-e1d1-4330-a818-4fb0e9917d63",
                "type": "EVIDENCE",
                "name": "E3",
                "description": "Bill of materials BOM-2.3, machine-readable: base model, fine-tuning datasets, libraries and file hashes for release 2.3. Generated by the release pipeline; assumes the pipeline sees every component it packages.",
                "inSandbox": false,
                "children": []
              }
            ],
            "level": 1
          },
          {
            "id": "6de7bb2b-dfde-46f8-8e5c-0b86bac1e9ef",
            "type": "PROPERTY_CLAIM",
            "name": "P3",
            "description": "The agent's incident-report fine-tuning data holds no group of planted examples above the detection threshold agreed with the utility's security team.",
            "inSandbox": false,
            "children": [
              {
                "id": "ee5ecdae-144c-4814-aa6b-b42e601fe498",
                "type": "EVIDENCE",
                "name": "E4",
                "description": "Poisoning screen report PS-2, table 1: each group of fine-tuning examples flagged at the agreed threshold, and the decision taken on it. Covers the fine-tuning set for release 2.3; run by the utility's data team; assumes planted examples form a separable group in the model's internal representations.",
                "inSandbox": false,
                "children": []
              }
            ],
            "level": 1
          }
        ],
        "justification": "Preventive defences act before the agent runs, on what it loads and on what it learned from."
      },
      {
        "id": "398c4ac0-8541-41aa-9c1b-406acc60515c",
        "type": "STRATEGY",
        "name": "S2",
        "description": "Argument over active threats, in two steps: identifying how the agent could be attacked, and testing it against those attacks.",
        "inSandbox": false,
        "children": [
          {
            "id": "f0e28804-5af5-4534-b794-021c516fd061",
            "type": "PROPERTY_CLAIM",
            "name": "P4",
            "description": "Every route by which the agent can be reached (the device data it reads, the tools it calls and its model supply chain) has its threats listed by priority in the agent's threat model.",
            "inSandbox": false,
            "children": [
              {
                "id": "4bec90ad-1a75-4631-ad86-9f08552c538d",
                "type": "EVIDENCE",
                "name": "E5",
                "description": "Threat model TM-3, sections 2 to 4, listing each route and threat with its priority, and review record RV-14, in which the utility's security team checked the routes against the agent's architecture. Covers release 2.3 and the digital twin; internal review; assumes the architecture description is complete.",
                "inSandbox": false,
                "children": []
              }
            ],
            "level": 1
          },
          {
            "id": "a35ff085-9b8e-4494-bf92-5ebcaccef909",
            "type": "PROPERTY_CLAIM",
            "name": "P5",
            "description": "The agent is robust to instructions planted in the device logs and configuration files it reads.",
            "inSandbox": false,
            "children": [
              {
                "id": "ebed1d26-eefa-4dd2-a7a4-9fa93a15e7b4",
                "type": "EVIDENCE",
                "name": "E6",
                "description": "Prompt-injection test report PI-2.3, table 2: 400 instructions planted in device logs and configuration files, and the agent's response to each. Covers release 2.3 in the test environment; run by the utility's security team; assumes the planted instructions represent those an attacker would use.",
                "inSandbox": false,
                "children": []
              }
            ],
            "level": 1
          },
          {
            "id": "ee0b6a2c-7272-4060-8c4b-5b0404edfeb9",
            "type": "PROPERTY_CLAIM",
            "name": "P6",
            "description": "Release 2.3 of the agent withstands every successful attack that a red team found when probing the agent and its digital twin for ways to weaken the live network.",
            "inSandbox": false,
            "children": [],
            "level": 1
          }
        ],
        "justification": "Threat modelling finds the attacks to defend against; testing shows whether the defences hold against them."
      }
    ],
    "role": "TOP_LEVEL",
    "context": [
      "Use: the utility's security engineers use the agent to find weaknesses in a digital twin of the pumping and treatment control network and to propose hardening changes. The agent runs in an isolated test environment and has no access to the live network.",
      "Secure: no attacker covered by the threat model can use the agent to alter, disrupt or read the live network, or to get a change that weakens it through engineering review."
    ],
    "justification": "Confidence: medium. The evidence covers release 2.3 of the agent only."
  }
}
